{"changed_paths":["/protocolSection/statusModule/overallStatus","/protocolSection/statusModule/lastUpdateSubmitDate","/protocolSection/statusModule/lastUpdatePostDateStruct/date","/protocolSection/statusModule/whyStopped","/protocolSection/designModule/enrollmentInfo/count","/protocolSection/designModule/enrollmentInfo/type"],"citation_text":"TrialDiff Evidence Record evt_NCT05967286_v1_v2_0b8d3fc7b429. ClinicalTrials.gov NCT05967286, versions 1-2. Evidence version 1.","claims_not_supported":["That the amendment was scientifically unjustified.","That the change constitutes misconduct or wrongdoing.","That sponsor intent can be inferred from this registry change.","That the change caused or altered the trial's results.","That the change was or was not disclosed in a manuscript.","That TrialDiff determines regulatory compliance or non-compliance.","That event-class membership is a validated global review-priority ranking."],"claims_supported":["TrialDiff compared ClinicalTrials.gov record version 1 to version 2 for NCT05967286.","The JSON Patch for this comparison has hash 9765d5be250f708044c57eb0b9b688758943525434f6f4e5f7041ba506160121.","The active deterministic rule set hash was fc87f4f0a74bc789dbe4ba85893c2c96f55db62c22970be4e991288104291621.","The deterministic triage label was critical; before timing adjustment it was critical.","The triage label is uncalibrated metadata, not a validated review-priority finding.","The patch satisfied these deterministic event-class predicates: enrollment_changed_to_zero.","A registry field under enrollment changed between ClinicalTrials.gov versions 1 and 2.","The timing context for the from-version record was pre_recruitment.","The deterministic rules that fired were: enrollment_count_change, enrollment_type_change, terminal_status_change, why_stopped_change.","The changed JSON Pointer paths were: /protocolSection/statusModule/overallStatus, /protocolSection/statusModule/lastUpdateSubmitDate, /protocolSection/statusModule/lastUpdatePostDateStruct/date, /protocolSection/statusModule/whyStopped, /protocolSection/designModule/enrollmentInfo/count, /protocolSection/designModule/enrollmentInfo/type.","The enrollment count changed from a positive value to zero.","The enrollment count changed from a positive value to zero between versions 1 and 2.","The changed paths include the ClinicalTrials.gov whyStopped field, a stopped-trial explanation field relevant to 42 CFR 11.64 when applicable."],"classification":{"calibration_status":"uncalibrated","categories":["status_termination","enrollment_change"],"category":"enrollment_change","deterministic_rules":["enrollment_count_change","enrollment_type_change","terminal_status_change","why_stopped_change"],"event_class_rule_set_hash":"74a6f55a686c29aa023171acd6b43f27ea95f2b0af2d49094ac70287ba4e502c","event_classes":["enrollment_changed_to_zero"],"rule_set_hash":"fc87f4f0a74bc789dbe4ba85893c2c96f55db62c22970be4e991288104291621","severity":"critical","severity_pre_timing":"critical","timing_context":"pre_recruitment","triage_label":"critical","triage_rule_set_hash":"af5e5835e00a5fcfe2a17fd02b5fc244c2564104f93f78a1d77d7889f12a178b","value_signals":[{"category":"enrollment_change","new_value":0,"old_value":111,"path":"/protocolSection/designModule/enrollmentInfo/count","pct_change":1.0,"severity":"critical","signal":"enrollment_zeroed"}]},"event_id":"evt_NCT05967286_v1_v2_0b8d3fc7b429","evidence_version":1,"patch":[{"op":"replace","path":"/protocolSection/statusModule/overallStatus","value":"WITHDRAWN"},{"op":"replace","path":"/protocolSection/statusModule/lastUpdateSubmitDate","value":"2023-08-24"},{"op":"replace","path":"/protocolSection/statusModule/lastUpdatePostDateStruct/date","value":"2023-08-25"},{"op":"add","path":"/protocolSection/statusModule/whyStopped","value":"Other - Protocol moved to Withdrawn"},{"op":"replace","path":"/protocolSection/designModule/enrollmentInfo/count","value":0},{"op":"replace","path":"/protocolSection/designModule/enrollmentInfo/type","value":"ACTUAL"}],"provenance":{"from_snapshot_hash":"612248f5e1387c7f40c9e9bcca827d2a8cbf2c868998ed9540072400b9ec86b8","materiality_event_hash":"6b47176b6100094561df35f6edd9e3f926a5a30d2e381e8f24bf94a4d320ea68","patch_hash":"9765d5be250f708044c57eb0b9b688758943525434f6f4e5f7041ba506160121","patch_raw_hash":"6dfd8a9aaf3dbd3e76583c1ba119f3c19c87e223b66354e2fe5609647c6cbe6e","patch_source":"ctgov_internal_history","patch_source_url":"https://clinicaltrials.gov/api/int/studies/NCT05967286/history/1?patchToVersion=2","to_snapshot_hash":"65bcffa0b53e9a168ae70503ad4a2281de9cd2722d7fd558e855fe06cc5a4349"},"review_question":"What explains the enrollment change, and does the change affect interpretation of trial feasibility or power?","schema":"trialdiff.evidence_record","trial":{"clinicaltrials_gov_url":"https://clinicaltrials.gov/study/NCT05967286","nct_id":"NCT05967286"},"versions":{"from_version":1,"submitted_date":"2023-08-24","to_version":2}}